name,start_date,start_time,end_date,end_time,location,street_address,admission,categories,event_website,description
The Holiday Market at Snowport 2024,"Friday, Nov 08, 2024",11:00a,"Sunday, Dec 29, 2024",9:00p,Seaport Common,100 Seaport Boulevard,FREE,"Date Idea, Festivals & Fairs, Outside, Seasonal, Shopping",https://www.bostonseaport.xyz/holidaymarket,"They may be small, but local businesses bring our community to life in a big way. The Holiday Market at Snowport Presented by Constant Contact, features 120+ makers, more food than ever before, custom cocktail bars, festive decor, live music, and more. Plan your ideal Snowport adventure and reserve your spot at the Seaport Holiday Market on weekends. Skip the lines by downloading the Seaport Insider App. WHERE: The Holiday Market is located at 100 Seaport Boulevard, right next to The Current.WHEN: The Holiday Market at Snowport Presented by Constant Contact will be open seven days a week November 8 - December 29, 2024.The Holiday Market will be closed Thanksgiving Day and Christmas Day.HOLIDAY MARKET HOURS: Monday - Thursday 3:00pm - 8:00pmFriday & Saturday 11:00am - 9:00pmSunday 11:00am - 8:00pmEXTENDED HOURS: During the peak holiday season (December 9 – December 29) the market will have extended hours.Monday - Thursday 11:00am - 8:00pmFriday & Saturday 11:00am - 9:00pmSunday 11:00am - 8:00pmFood & Beverage Tent by JetBlueThe Holiday Market has more food and beverage than ever before and you can enjoy it under the heated tent by JetBlue. The heated tent from JetBlue provides additional beer garden style seating and is also available for private and semi-private events. And while you're there, book your next warm-weather destination via JetBlue.Discover a variety of festive craft cocktails and warm drinks to enjoy, from the themed bars - the Jingle Bar adorned in hundreds of bells, The Dizzy Dreidel decked with spinning dreidels, Betty’s Bar to honor Snowport’s special guest, and The Blizzard Bar covered in snow. New this year, each holiday-themed bar will have its own signature cocktail & mocktail like the Betty the Yeti-ni and Dizzy Eggnog Dizzy.The Stage by Mohegan SunNew this year, The Stage by Mohegan Sun. Local musicians will perform live atop the Jingle Bar every Monday during market hours, playing original songs and holiday favorites. Mohegan Music Mondays is one of the best ways to listen to a diverse lineup of Boston’s most creative local musicians as they perform against the stunning backdrop of Seaport each week in an incredible concert series.Live music schedule: get festive with live music every week at The Stage by Mohegan Sun inside The Holiday Market at Snowport. Join us for a rotating line up of local artists who will take the stage on Mondays starting at 5:00PM.11/11: Lourde Childs11/18: Preston Lydotes11/25: Sofia Corts12/2: MAMO12/9: Jack Whitney12/16: Olivia Monarch12/23: AnaliseWinter Wish WallDiscover the Winter Wish Wall by Mass General Brigham Health Plan, a giant chalkboard where you can share your holiday wishes.Presents Place by LexusVisit Presents Place by Lexus, a stunning backdrop of colorful, oversized gifts with a new photobooth element allowing your and your friends to create the perfect holiday snapshot.The Mistletoe ArchDiscover love with our mistletoe arch. This 10-foot arch is adorned with beautiful holiday greenery, garland, and mistletoe, and “Kiss Me” written across the top.The Crafting CornerDiscover The Crafting Corner by The Maker’s Club with daily drop-in crafting sessions for adults and kids, and featuring activities like mason jar snow globes, wreath decorating, and sensory bins for kids.A New App To Plan Your Snowport Adventure (COMING SOON)Starting on November 1, download the Seaport Insider App to reserve a time to visit The Holiday Market. The app offers tickets for purchase, allowing guests an option to reserve a time slot where they can enter the market within a 30-minute window of their reservation.As in years past, The Holiday Market will continue to offer free admission via a General Admissions line to all, seven days a week. Timed entry ticket reservations are available on weekends only, Friday – Sunday.Weekend timed-entry ticket details:$12 per adult$6 per Veteran$6 per child (ages 6-17, children under the age of 5 are free)$1 per ticket sold benefits Boston XChange (BXC)Also use the App to plan your Snowport adventure. View neighborhood-wide special offers, events in the market and across the neighborhood, a gift guide, maps, and more.Download our Holiday Market Map to prep for your next visit. They may be small, but local businesses bring our community to life in a big way. The Holiday Market at Snowport Presented by Constant Contact, features 120+ makers, more food than ever before, custom cocktail bars, festive decor, live music, and more. Plan your ideal Snowport adventure and reserve your spot at the Seaport Holiday Market on weekends. Skip the lines by downloading the Seaport Insider App. WHERE: The Holiday Market is located at 100 Seaport Boulevard, right next to The Current. WHEN: The Holiday Market at Snowport Presented by Constant Contact will be open seven days a week November 8 - December 29, 2024. The Holiday Market will be closed Thanksgiving Day and Christmas Day. HOLIDAY MARKET HOURS: EXTENDED HOURS: During the peak holiday season (December 9 – December 29) the market will have extended hours. Food & Beverage Tent by JetBlue The Holiday Market has more food and beverage than ever before and you can enjoy it under the heated tent by JetBlue. The heated tent from JetBlue provides additional beer garden style seating and is also available for private and semi-private events. And while you're there, book your next warm-weather destination via JetBlue. Discover a variety of festive craft cocktails and warm drinks to enjoy, from the themed bars - the Jingle Bar adorned in hundreds of bells, The Dizzy Dreidel decked with spinning dreidels, Betty’s Bar to honor Snowport’s special guest, and The Blizzard Bar covered in snow. New this year, each holiday-themed bar will have its own signature cocktail & mocktail like the Betty the Yeti-ni and Dizzy Eggnog Dizzy. The Stage by Mohegan Sun New this year, The Stage by Mohegan Sun. Local musicians will perform live atop the Jingle Bar every Monday during market hours, playing original songs and holiday favorites. Mohegan Music Mondays is one of the best ways to listen to a diverse lineup of Boston’s most creative local musicians as they perform against the stunning backdrop of Seaport each week in an incredible concert series. Live music schedule: get festive with live music every week at The Stage by Mohegan Sun inside The Holiday Market at Snowport. Join us for a rotating line up of local artists who will take the stage on Mondays starting at 5:00PM. 11/11: Lourde Childs 11/18: Preston Lydotes 11/25: Sofia Corts 12/2: MAMO 12/9: Jack Whitney 12/16: Olivia Monarch 12/23: Analise Winter Wish Wall Discover the Winter Wish Wall by Mass General Brigham Health Plan, a giant chalkboard where you can share your holiday wishes. Presents Place by Lexus Visit Presents Place by Lexus, a stunning backdrop of colorful, oversized gifts with a new photobooth element allowing your and your friends to create the perfect holiday snapshot. The Mistletoe Arch Discover love with our mistletoe arch. This 10-foot arch is adorned with beautiful holiday greenery, garland, and mistletoe, and “Kiss Me” written across the top. The Crafting Corner Discover The Crafting Corner by The Maker’s Club with daily drop-in crafting sessions for adults and kids, and featuring activities like mason jar snow globes, wreath decorating, and sensory bins for kids. A New App To Plan Your Snowport Adventure (COMING SOON) Starting on November 1, download the Seaport Insider App to reserve a time to visit The Holiday Market. The app offers tickets for purchase, allowing guests an option to reserve a time slot where they can enter the market within a 30-minute window of their reservation. As in years past, The Holiday Market will continue to offer free admission via a General Admissions line to all, seven days a week. Timed entry ticket reservations are available on weekends only, Friday – Sunday. Weekend timed-entry ticket details: $1 per ticket sold benefits Boston XChange (BXC) Also use the App to plan your Snowport adventure. View neighborhood-wide special offers, events in the market and across the neighborhood, a gift guide, maps, and more. Download our Holiday Market Map to prep for your next visit."
A Holly Jolly Good Time Holiday Market,Not specified,Not specified,Not specified,Not specified,Time Out Market Boston,401 Park Drive,FREE,"Art, Date Idea, Drinks, Food, Good for Groups, Kid Friendly, LGBTQ+, Meetup, Music, Party, Seasonal, Shopping",https://www.eventbrite.com/e/a-holly-jolly-good-time-holiday-market-tickets-1041975034377,"Join us on Saturday, November 16th from 12-5 PM for a Holly Jolly Holiday Market at Time Out Market! Discover unique, handcrafted gifts from LGBTQ+ makers and vendors, offering everything from artisanal jewelry to holiday-themed art. Enjoy live music, festive cocktails, and seasonal snacks as you shop. Kick off the holiday season with friends, good vibes, and support for local artisans!List of featured vendors coming soon. Join us on Saturday, November 16th from 12-5 PM for a Holly Jolly Holiday Market at Time Out Market! Discover unique, handcrafted gifts from LGBTQ+ makers and vendors, offering everything from artisanal jewelry to holiday-themed art. Enjoy live music, festive cocktails, and seasonal snacks as you shop. Kick off the holiday season with friends, good vibes, and support for local artisans!List of featured vendors coming soon."
The Festival of Italian Creativity,"Thursday, Nov 14, 2024",11:00a,"Friday, Nov 22, 2024",5:00p,The Consulate General of Italy,600 Atlantic Avenue,FREE,"Art, Festivals & Fairs, Food",https://tinyurl.com/ItalyInBostonRegistration,"From November 14 to 22, the Consulate General of Italy in Boston is launching “The Festival of Italian Creativity”, an amazing range cultural events (music, cinema, art, literature and theater), science, technology and business seminars, Italian language labs, food tastings, inspirational guests and much more! All of the events and programs in the Festival, organized in cooperation with the October Italian American Heritage Month Committee of Massachusetts, are open to the public and FREE of charge with registration. The complete program of events is online at https://tinyurl.com/ItalyInBostonProgram and all events are available with a single registration at https://tinyurl.com/ItalyInBostonRegistration.The Festival is part of the Italian Ministry of Foreign Affairs designation of Boston as “2024 Capital of Italian Creativity in the World”. “The Festival of Italian Creativity is an extraordinary opportunity to promote Italy and highlight the many connections between Italy and Boston, as well as to celebrate the contributions of the Italian American community to the historic and contemporary fabric of the city”, said Arnaldo Minuti, Consul General of Italy in Boston. From November 14 to 22, the Consulate General of Italy in Boston is launching “The Festival of Italian Creativity”, an amazing range cultural events (music, cinema, art, literature and theater), science, technology and business seminars, Italian language labs, food tastings, inspirational guests and much more! All of the events and programs in the Festival, organized in cooperation with the October Italian American Heritage Month Committee of Massachusetts, are open to the public and FREE of charge with registration. The complete program of events is online at https://tinyurl.com/ItalyInBostonProgram and all events are available with a single registration at https://tinyurl.com/ItalyInBostonRegistration. The Festival is part of the Italian Ministry of Foreign Affairs designation of Boston as “2024 Capital of Italian Creativity in the World”. “The Festival of Italian Creativity is an extraordinary opportunity to promote Italy and highlight the many connections between Italy and Boston, as well as to celebrate the contributions of the Italian American community to the historic and contemporary fabric of the city”, said Arnaldo Minuti, Consul General of Italy in Boston."
Night Cap Cafe,"Wednesday, Nov 06, 2024",6:00p,"Thursday, Nov 21, 2024",11:00p,Boston City Hall,1 City Hall Square,FREE,"Art, LGBTQ+, Music, Nightlife",https://nightcap.cafe,"Wake up & Smell the Coffee B*tches,Night Cap is a 8- night Pop-Up night cafe & listening lounge featuring a rotating Menu of DJs, Artists, Vendors, & Other Fun Sh*t in the lobby of Boston City Hall.From live house music from & stand-up comedy to queer speed dating, we offer bold experiences in an inclusive substance-free environment. *For the wine girlies out there, our Creative Collab Night will feature Rebel Rebel Wine Bar.* Check out art and goods from local vendors in a moonlit market place. Night Cap isn’t just another night out; it’s where culture and creativity meet over a cup of joe.Come play with us:Nov. 6th: Opening NightNov. 7th: Queer-Friend-Speed DatingNov. 12th: ✨Listening Lounge✨Nov. 13th: Comedy NightNov. 14th: Creative Meet Up w/ Rebel Rebel Wine BarNov. 19th: Fashion & Figure DrawingNov. 20th: Dungeons & Dragons Character WorkshopNov. 21st: Slumber Party Closing CeremonyEAT, SLEEP, DRINK, SHOP LOCAL. ~ pro tip: bring your own mug for $1 off ☕Check out our instagram to learn more about our vibehttps://www.instagram.com/night_cap_cafe/ Wake up & Smell the Coffee B*tches, Night Cap is a 8- night Pop-Up night cafe & listening lounge featuring a rotating Menu of DJs, Artists, Vendors, & Other Fun Sh*t in the lobby of Boston City Hall. From live house music from & stand-up comedy to queer speed dating, we offer bold experiences in an inclusive substance-free environment. *For the wine girlies out there, our Creative Collab Night will feature Rebel Rebel Wine Bar.* Check out art and goods from local vendors in a moonlit market place. Night Cap isn’t just another night out; it’s where culture and creativity meet over a cup of joe. Come play with us: EAT, SLEEP, DRINK, SHOP LOCAL. ~ pro tip: bring your own mug for $1 off ☕ Check out our instagram to learn more about our vibe https://www.instagram.com/night_cap_cafe/"
The Sunday Bazaar,Not specified,Not specified,Not specified,Not specified,Brighton Elks Lodge,326 Washington St.,FREE,"Art, Festivals & Fairs, Pet Friendly, Shopping",https://www.facebook.com/share/1AayRP3b9e/,"It’s the season finale of our Sunday Bazaar at the Brighton Elks Lodge in Boston! If you’ve been missing out, this is your last chance until Spring!! On November 17th from 11am-5pm, over 100 small local businesses are popping up to sell art, vinyl, vintage, & more!**********************11/17 Announcements: Poster by @haunteddollco . Find them at the Bazaar on 11/17, or online: https://tinyurl.com/bdemwxct🐻‍❄️🫧 local legends @polarseltzer are giving out fun flavors of free fizz! DJ: The dynamic duo of @wileylovescats & @jessamy.shay are going to spin the day away! You may know them from the Space Exotica Lounge Night at @verasunionsq , an absolutely can’t-miss party of groovy vintage vibes! After you visit the market, check out our new store @thebrightonemporium nearby at 406 Western Ave 02135, with another 40 small local businesses! Open 11am-7pm Thursday to Monday.***Info & FAQs*** Date: 11/17 Time: 11am-5pmAddress:Enter from the lodge door at 326 Washington St. 02135, or the pedestrian gate at 14 Academy Hill Rd. 02135 Admission: free! Weather:- The Sunday Bazaar has both indoor and outdoor sections, it happens rain or shine. The outdoor section is in the rear parking lot, the indoor section is inside the Lodge.Transportation: Bus:- 57 line, right next to Washington St. @ Waldo Terrace stop.- 86 line, 2 min walk from Chestnut Hill Ave @ Washington St. stop Bike:- bike posts on Washington St.- chain-link fence to lock your bike at 14 Academy Hill Road Drive:Free public parking lots less than a 5-minute walk away:- 400 Market St.- 198 Wirt St. / 301 Washington St.- 49 Chestnut Hill Ave. (Library & Courthouse closed on Sundays)Plenty of free public street parking throughout Brighton Center. No public parking enforcement on Sundays! Accessibility: The whole facility is at grade, no stairs anywhere! ADA parking spaces available in all parking lots listed above. Pets: are welcome throughout the Bazaar! Applications: https://linktr.ee/thebrightonbazaar Vendor List (partial, may change):@a_decade_apart_vintage@abby.b.art@alliekeastjewelry@alltheragevintage@alwaysjean@angelcoshop@anniemorford @everupwardstudios@antheathreads@aprilsprintedgarden @swirlsnstones@arteri09@aurorawhimsy@beechstpottery@betsymcreative@big_bad_wolf_shop@blueheronclothingco@bmccormick86@buffalospidersantiques@burgerghost@burningbrewscandles@candigoldstein@caramics.pottery & @connieomg_@cgjewelrydesign@charliesellsvintage@citizenscrochet@cloud9resale@crvieart@cryptic_croc@danalicealice@dannydesignsma@deathcapdecor@e.h.rykiel@ebpotsporcelain@envision_lin@evoleye@faded_thrift@fearnodecay@feralfawnart@fibercat@fionaandhoney@flamchowdah@garbageworld404@goodformdesigns@heathdopaint@hecho_a_mano_@hendisvintage@hollystwpoetry@homesweethomestudio@hope.hypesquad@hudon.dave@iluminade11@jaxolinetheartist@jillklydon@jmsmagid_creations@knotty_hangers@lavender.splendid@lendahanddesigns@lincolnsunderwater@LinkaCreates@lynick_creations@marianneradnitzky@merchmerchmerch_screenprints@missmaaarisss@montgomery_green@moondrops__@morrow.little.candle@mrblobguy@mudhedz@nittlesart @fatalforage@olimclayco@ostrajewelry@phatfroots and @thedivine botanic@poodlepackgear@re.liv.d@rebookedboston@rememberingbunnies@replayedathletic@rexwraps@rlnhandmade@rutabaga_prints@sacredflameri@salemandsouth@salemwillow.witch@samkimceramics@sarshaha@saturnpeachart@Seabibidesigns@shopcocobunny@shopmadebymorgannicole@shoprideon@sisterscurated@sloburncandle@SpellboundCandleComp@srg.pottery@sugalski.ceramics@superettesignco@sweetestthingshop@thatscorpioartist@the.nymphs.curio@thecypruscabinet@therainbowrackboutique@thevintageaurora@thriftiebrookie@timeless_kitty; @cloverpatchjewelry@toadiebird@trashbirdshop@unknownsundayco@vanessamnorris@wildplanet.shop@withlovelaurencrafts@wormie_dreamhouse_shop@yankeethrifting It’s the season finale of our Sunday Bazaar at the Brighton Elks Lodge in Boston! If you’ve been missing out, this is your last chance until Spring!! On November 17th from 11am-5pm, over 100 small local businesses are popping up to sell art, vinyl, vintage, & more! ********************** 11/17 Announcements: Poster by @haunteddollco . Find them at the Bazaar on 11/17, or online: https://tinyurl.com/bdemwxct 🐻‍❄️🫧 local legends @polarseltzer are giving out fun flavors of free fizz! DJ: The dynamic duo of @wileylovescats & @jessamy.shay are going to spin the day away! You may know them from the Space Exotica Lounge Night at @verasunionsq , an absolutely can’t-miss party of groovy vintage vibes! After you visit the market, check out our new store @thebrightonemporium nearby at 406 Western Ave 02135, with another 40 small local businesses! Open 11am-7pm Thursday to Monday. ***Info & FAQs*** Date: 11/17 Time: 11am-5pm Address: Enter from the lodge door at 326 Washington St. 02135, or the pedestrian gate at 14 Academy Hill Rd. 02135 Admission: free! Weather: - The Sunday Bazaar has both indoor and outdoor sections, it happens rain or shine. The outdoor section is in the rear parking lot, the indoor section is inside the Lodge. Transportation: Bus: - 57 line, right next to Washington St. @ Waldo Terrace stop. - 86 line, 2 min walk from Chestnut Hill Ave @ Washington St. stop Bike: - bike posts on Washington St. - chain-link fence to lock your bike at 14 Academy Hill Road Drive: Free public parking lots less than a 5-minute walk away: - 400 Market St. - 198 Wirt St. / 301 Washington St. - 49 Chestnut Hill Ave. (Library & Courthouse closed on Sundays) Plenty of free public street parking throughout Brighton Center. No public parking enforcement on Sundays! Accessibility: The whole facility is at grade, no stairs anywhere! ADA parking spaces available in all parking lots listed above. Pets: are welcome throughout the Bazaar! Applications: https://linktr.ee/thebrightonbazaar Vendor List (partial, may change): @a_decade_apart_vintage @abby.b.art @alliekeastjewelry @alltheragevintage @alwaysjean @angelcoshop @anniemorford @everupwardstudios @antheathreads @aprilsprintedgarden @swirlsnstones @arteri09 @aurorawhimsy @beechstpottery @betsymcreative @big_bad_wolf_shop @blueheronclothingco @bmccormick86 @buffalospidersantiques @burgerghost @burningbrewscandles @candigoldstein @caramics.pottery & @connieomg_ @cgjewelrydesign @charliesellsvintage @citizenscrochet @cloud9resale @crvieart @cryptic_croc @danalicealice @dannydesignsma @deathcapdecor @e.h.rykiel @ebpotsporcelain @envision_lin @evoleye @faded_thrift @fearnodecay @feralfawnart @fibercat @fionaandhoney @flamchowdah @garbageworld404 @goodformdesigns @heathdopaint @hecho_a_mano_ @hendisvintage @hollystwpoetry @homesweethomestudio @hope.hypesquad @hudon.dave @iluminade11 @jaxolinetheartist @jillklydon @jmsmagid_creations @knotty_hangers @lavender.splendid @lendahanddesigns @lincolnsunderwater @LinkaCreates @lynick_creations @marianneradnitzky @merchmerchmerch_screenprints @missmaaarisss @montgomery_green @moondrops__ @morrow.little.candle @mrblobguy @mudhedz @nittlesart @fatalforage @olimclayco @ostrajewelry @phatfroots and @thedivine botanic @poodlepackgear @re.liv.d @rebookedboston @rememberingbunnies @replayedathletic @rexwraps @rlnhandmade @rutabaga_prints @sacredflameri @salemandsouth @salemwillow.witch @samkimceramics @sarshaha @saturnpeachart @Seabibidesigns @shopcocobunny @shopmadebymorgannicole @shoprideon @sisterscurated @sloburncandle @SpellboundCandleComp @srg.pottery @sugalski.ceramics @superettesignco @sweetestthingshop @thatscorpioartist @the.nymphs.curio @thecypruscabinet @therainbowrackboutique @thevintageaurora @thriftiebrookie @timeless_kitty; @cloverpatchjewelry @toadiebird @trashbirdshop @unknownsundayco @vanessamnorris @wildplanet.shop @withlovelaurencrafts @wormie_dreamhouse_shop @yankeethrifting"
Huge Fall Vintage Clothing Pop-up Thrift Market,Not specified,Not specified,Not specified,Not specified,Reggie Lewis Center,1350 Tremont St,FREE,"Festivals & Fairs, Good for Groups, Party, Shopping",https://www.instagram.com/select.markets/,"BOSTON, we are hosting one of the BIGGEST Vintage Markets in Mass EVER!Over 90+ Vendors, 80k SQ FT of Vintage, Y2k, $10 Piles, Food Trucks, temp tats, tooth gems, free drinks, and so much more!!Find some new clothes, grab some food, and hangout with friends!SEE YOU ON NOVEMBER 16TH ❤️@select.markets on Instagram for more details BOSTON, we are hosting one of the BIGGEST Vintage Markets in Mass EVER! Over 90+ Vendors, 80k SQ FT of Vintage, Y2k, $10 Piles, Food Trucks, temp tats, tooth gems, free drinks, and so much more!! Find some new clothes, grab some food, and hangout with friends! SEE YOU ON NOVEMBER 16TH ❤️ @select.markets on Instagram for more details"
Harboring Creativity: Art Sale and Exhibit,"Saturday, Nov 16, 2024",11:00a,"Sunday, Nov 17, 2024",4:00p,ICA Watershed,256 Marginal Street,FREE,"Art, Food, Photoworthy, Social Good",https://www.eastbostonartistsgroup.com/,"Join us for East Boston’s vibrant art scene at “Harboring Creativity” on November 16th and 17th, from 11 AM to 4 PM at the ICA Watershed. Located at the heart of the Boston Shipyard, this free event will be showcasing 40+ artists from the Boston area including paintings, photography, and sculptures with art available for purchase. Boston Showcased artists will be hosting art seminars to share their creativity and experience in the art field. There will be various food options catered from local restaurants. Highlights in the film department include screenings of Abre tu Corazón: Historias de Imigrantes de Boston y Más Allá and short films by EBAG member Alberto Roblest. To reserve your free spot, RSVP at https://www.eastbostonartistsgroup.com/. East Boston Artist Group is a community that enriches the community through art, to learn more go to https://www.eastbostonartistsgroup.com/ Join us for East Boston’s vibrant art scene at “Harboring Creativity” on November 16th and 17th, from 11 AM to 4 PM at the ICA Watershed. Located at the heart of the Boston Shipyard, this free event will be showcasing 40+ artists from the Boston area including paintings, photography, and sculptures with art available for purchase. Boston Showcased artists will be hosting art seminars to share their creativity and experience in the art field. There will be various food options catered from local restaurants. Highlights in the film department include screenings of Abre tu Corazón: Historias de Imigrantes de Boston y Más Allá and short films by EBAG member Alberto Roblest. To reserve your free spot, RSVP at https://www.eastbostonartistsgroup.com/. East Boston Artist Group is a community that enriches the community through art, to learn more go to https://www.eastbostonartistsgroup.com/"
