name,start_date,start_time,end_date,end_time,location,street_address,admission,categories,event_website,description
The 19 Best “Happy Hour” Food & Drink Deals Around Boston That Are Actually Worth It,"Thursday, Aug 01, 2024",10:00a,"Tuesday, Dec 31, 2024",11:30p,Boston,Surrounding areas,$Varies,"Date Idea, Drinks, Food, Good for Groups",https://joyraft.com/event/the-19-best-happy-hour-food-drink-deals-around-boston-that-are-actually-worth-it-boston-1003226,"Although Boston technically doesn’t have Happy Hour, (for now, there’s legislation in the works about it) there are lots of deals on food and drinks to enjoy about town. Enjoy all the culinary and cocktail delights of Boston, without breaking the bank using these Happy Hour deals.Looking for oysters? Check out these $1 oyster deals around the city. by Celina Colby1) Happy Hour at BarcelonaWhen: Mon-Fri 4pm-6pm Where: South End, BrooklineInfo: During Happy Hour at Barcelona’s South End and Brookline locations you can get $7 martinis and espresso martinis, $4 beers, and a selection of tapas ranging from $5-$9 apiece. 2) Happy Hour 50¢ Dumplings at Banyan Bar + RefugeWhen: Mon-Sun 4pm-6pmWhere: South EndInfo: Satisfy your dumpling cravings every day at Banyan Bar + Refuge where you can get 10 dumplings for $5 as well as deals on other apps like a scallion pancake roll ($7) and prawn toast ($8). 3) $8 Spritzes at Tuscan Kitchen SeaportWhen: All day, every day through 8/31Where: SeaportInfo: Make the most of the last few weeks of summer with $8 spritzes all day every day at Tuscan Kitchen Seaport during the month of August. While you’re sipping, order up $2 oysters from the bar, 3-6pm daily. 4) $3 Tacos at Loco Taqueria & Oyster BarWhen: Tue 11am-1amWhere: Fenway, South BostonInfo: Celebrate Taco Tuesday with half off all tacos every Tuesday at Loco Taqueria in Fenway and South Boston. Those savings can go straight towards another round of margaritas! 5) Bottomless Pasta Wednesdays at Capo Restaurant & Supper ClubWhen: Wed 4-10pmWhere: South BostonInfo: For ust $32 you can eat unlimited plates of pasta every Wednesday at Capo Restaurant & Supper Club in South Boston. Try every flavor and then you’ll know your favorite for the next week!6) Bottomless Maki for $32 at Fat BabyWhen: Mon 4pm-10pmWhere: South BostonInfo: For just $32 per person you can eat UNLIMITED maki at Fat Baby. There are six rolls to choose from on this Happy Hour menu. The only rule is no sharing and honestly, why would you want to? 7) Bottomless Steak Frites at BatifolWhen: Sun 4-10pmWhere: Kendall SquareInfo: Every Sunday night at Batifol in Cambridge you can live your best (unlimited) Parisian life with bottomless steak frites. For $37 you’ll receive steak, French fries, and the restaurant’s secret sauce with unlimited refills.8) $5 Tapas at TascaWhen: Tue 4-6pmWhere: BrightonInfo: Try a little bit of everything with $5 tapas during this foodie happy hour every Tuesday at Tasca. It’s a great opportunity to try new things at this authentic Spanish restaurant.9) $5 Mimosas at Ward 8When: Sat-Sun 10am-3pmWhere: West EndInfo: Brunch just got a whole lot better with $5 mimosas at Ward 8 in the West End. There’s no better compliment to chicken and waffles, avocado toast, and breakfast burgers.10) Shy Hour at Shy Bird South BostonWhen: Mon-Fri 4-6pmWhere: South BostonInfo: Every weekday at the South Boston location of Shy Bird you can enjoy 50¢ fried chicken dunks, a $9.99 smash burger, $9 cocktails, $6 tall boys and more during their Shy Hour answer to Happy Hour.11) $10 Martinis at Petula'sWhen: Mon 5pm to closeWhere: South BostonInfo: Every Monday you can order $10 martinis at Petula’s in South Boston from 5pm to close. That includes everybody’s favorite, the espresso martini. They also offer free fries when you order a glass of bubbly Monday-Friday 11:30am-5pm.12) Half-off Sandwiches after 10pm at Parish CafeWhen: Sun-Wed 11:30am-12am, Thu-Sat 11:30am-2amWhere: Back BayInfo: Take advantage of this late night (for Boston) deal, where all sandwiches at Parish Cafe are 50% off after 10pm. On weekends they’re open late so it’s a great end-of-the-night spot to fuel up.13) 50% off the Full Menu at Grendel’s DenWhen: Mon-Sun 5pm-7:30pmWhere: Harvard SquareInfo: For two and half hours every day the entire menu at Grendel’s Den is 50% off. The only parameters are that you must order an alcoholic beverage to go with it and you can’t use to-go boxes to turn the deal into grocery shopping.14) Oysters & Prosecco for $18 at The BroadwayWhen: Sun 4-7pmWhere: South BostonInfo: Class it up on a budget with this Sunday Funday deal at The Broadway in South Boston. Get 6 oysters and a glass of prosecco for a grand total of $18. 15) Half-off Pizzas at The BroadwayWhen: Tue 11:30am-1amWhere: South BostonInfo: Every Tuesday you can get half-off all pizzas at The Broadway in South Boston. Grab some friends and prepare for the most affordable pizza party of all time.16) Happy Hour at Yard House FenwayWhen: Mon-Fri 3-6pmWhere: FenwayInfo: Every weekday you can enjoy half off select apps at Yard House in Fenway plus half off all pizzas, even the fancy truffle mushroom. Keep in mind this deal doesn’t apply during other Yard House events.17) Happy Hour at Local 149When: Tue-Thur 4pm-11pmWhere: South BostonInfo: Get Happy Hour deals three days a week at this local hub. On Tuesday get tacos for $3 apiece, on Wednesday get sliders for $4 apiece, and on Thursday get flatbreads for $10 apiece.18) Bottomless Bubbles, Bites & Flights Brunch at Flight ClubWhen: Sat-Sun 11am-3pmWhere: SeaportInfo: Book a brunch package for Flight Club’s Seaport location and get bottomless flatbreads for $45/per person, bottomless mimosas for $55/per person, or bottomless of both for $65/per person. Note, you need at least six people in the party and everyone needs to order this package. 19) Mucho Mondays at Painted BurroWhen: Mon 4-11:30pmWhere: Harvard SquareInfo: Try bottomless tapas at Painted Burro in Harvard Square every Monday night. Pay $21 for endless orders from the appetizers, salads, tacos, tortas, and enchiladas sections of the menu.--Photo by @bucketlistboston Although Boston technically doesn’t have Happy Hour, (for now, there’s legislation in the works about it) there are lots of deals on food and drinks to enjoy about town. Enjoy all the culinary and cocktail delights of Boston, without breaking the bank using these Happy Hour deals. Looking for oysters? Check out these $1 oyster deals around the city. by Celina Colby 1) Happy Hour at Barcelona When: Mon-Fri 4pm-6pm Where: South End, Brookline Info: During Happy Hour at Barcelona’s South End and Brookline locations you can get $7 martinis and espresso martinis, $4 beers, and a selection of tapas ranging from $5-$9 apiece. 2) Happy Hour 50¢ Dumplings at Banyan Bar + Refuge When: Mon-Sun 4pm-6pm Where: South End Info: Satisfy your dumpling cravings every day at Banyan Bar + Refuge where you can get 10 dumplings for $5 as well as deals on other apps like a scallion pancake roll ($7) and prawn toast ($8). 3) $8 Spritzes at Tuscan Kitchen Seaport When: All day, every day through 8/31 Where: Seaport Info: Make the most of the last few weeks of summer with $8 spritzes all day every day at Tuscan Kitchen Seaport during the month of August. While you’re sipping, order up $2 oysters from the bar, 3-6pm daily. 4) $3 Tacos at Loco Taqueria & Oyster Bar When: Tue 11am-1am Where: Fenway, South Boston Info: Celebrate Taco Tuesday with half off all tacos every Tuesday at Loco Taqueria in Fenway and South Boston. Those savings can go straight towards another round of margaritas! 5) Bottomless Pasta Wednesdays at Capo Restaurant & Supper Club When: Wed 4-10pm Where: South Boston Info: For ust $32 you can eat unlimited plates of pasta every Wednesday at Capo Restaurant & Supper Club in South Boston. Try every flavor and then you’ll know your favorite for the next week! 6) Bottomless Maki for $32 at Fat Baby When: Mon 4pm-10pm Where: South Boston Info: For just $32 per person you can eat UNLIMITED maki at Fat Baby. There are six rolls to choose from on this Happy Hour menu. The only rule is no sharing and honestly, why would you want to? 7) Bottomless Steak Frites at Batifol When: Sun 4-10pm Where: Kendall Square Info: Every Sunday night at Batifol in Cambridge you can live your best (unlimited) Parisian life with bottomless steak frites. For $37 you’ll receive steak, French fries, and the restaurant’s secret sauce with unlimited refills. 8) $5 Tapas at Tasca When: Tue 4-6pm Where: Brighton Info: Try a little bit of everything with $5 tapas during this foodie happy hour every Tuesday at Tasca. It’s a great opportunity to try new things at this authentic Spanish restaurant. 9) $5 Mimosas at Ward 8 When: Sat-Sun 10am-3pm Where: West End Info: Brunch just got a whole lot better with $5 mimosas at Ward 8 in the West End. There’s no better compliment to chicken and waffles, avocado toast, and breakfast burgers. 10) Shy Hour at Shy Bird South Boston When: Mon-Fri 4-6pm Where: South Boston Info: Every weekday at the South Boston location of Shy Bird you can enjoy 50¢ fried chicken dunks, a $9.99 smash burger, $9 cocktails, $6 tall boys and more during their Shy Hour answer to Happy Hour. 11) $10 Martinis at Petula's When: Mon 5pm to close Where: South Boston Info: Every Monday you can order $10 martinis at Petula’s in South Boston from 5pm to close. That includes everybody’s favorite, the espresso martini. They also offer free fries when you order a glass of bubbly Monday-Friday 11:30am-5pm. 12) Half-off Sandwiches after 10pm at Parish Cafe When: Sun-Wed 11:30am-12am, Thu-Sat 11:30am-2am Where: Back Bay Info: Take advantage of this late night (for Boston) deal, where all sandwiches at Parish Cafe are 50% off after 10pm. On weekends they’re open late so it’s a great end-of-the-night spot to fuel up. 13) 50% off the Full Menu at Grendel’s Den When: Mon-Sun 5pm-7:30pm Where: Harvard Square Info: For two and half hours every day the entire menu at Grendel’s Den is 50% off. The only parameters are that you must order an alcoholic beverage to go with it and you can’t use to-go boxes to turn the deal into grocery shopping. 14) Oysters & Prosecco for $18 at The Broadway When: Sun 4-7pm Where: South Boston Info: Class it up on a budget with this Sunday Funday deal at The Broadway in South Boston. Get 6 oysters and a glass of prosecco for a grand total of $18. 15) Half-off Pizzas at The Broadway When: Tue 11:30am-1am Where: South Boston Info: Every Tuesday you can get half-off all pizzas at The Broadway in South Boston. Grab some friends and prepare for the most affordable pizza party of all time. 16) Happy Hour at Yard House Fenway When: Mon-Fri 3-6pm Where: Fenway Info: Every weekday you can enjoy half off select apps at Yard House in Fenway plus half off all pizzas, even the fancy truffle mushroom. Keep in mind this deal doesn’t apply during other Yard House events. 17) Happy Hour at Local 149 When: Tue-Thur 4pm-11pm Where: South Boston Info: Get Happy Hour deals three days a week at this local hub. On Tuesday get tacos for $3 apiece, on Wednesday get sliders for $4 apiece, and on Thursday get flatbreads for $10 apiece. 18) Bottomless Bubbles, Bites & Flights Brunch at Flight Club When: Sat-Sun 11am-3pm Where: Seaport Info: Book a brunch package for Flight Club’s Seaport location and get bottomless flatbreads for $45/per person, bottomless mimosas for $55/per person, or bottomless of both for $65/per person. Note, you need at least six people in the party and everyone needs to order this package. 19) Mucho Mondays at Painted Burro When: Mon 4-11:30pm Where: Harvard Square Info: Try bottomless tapas at Painted Burro in Harvard Square every Monday night. Pay $21 for endless orders from the appetizers, salads, tacos, tortas, and enchiladas sections of the menu. -- Photo by @bucketlistboston"
"BSO, Open Rehearsal: Tchaikovsky Symphony No. 6, Pathétique",Not specified,Not specified,Not specified,Not specified,Boston Symphony Orchestra,301 Massachusetts Ave,$25+,"Date Idea, Music, Shows",https://www.bso.org/events/open-rehearsal-tchaikovsky-symphony-6,"Canadian pianist Jan Lisiecki is the soloist in Mozart’s mysterious and stormy Piano Concerto No. 20 in D minor which owes much to the composer’s sensitivity to operatic drama and expressivity. This concerto was particularly admired by artists of the Romantic era. Pyotr Ilyich Tchaikovsky said of his poignant Symphony No. 6, Pathétique, “I love it as I have never loved any of my musical children.” It was his last completed work; he led the premiere less than two weeks before his death Canadian pianist Jan Lisiecki is the soloist in Mozart’s mysterious and stormy Piano Concerto No. 20 in D minor which owes much to the composer’s sensitivity to operatic drama and expressivity. This concerto was particularly admired by artists of the Romantic era. Pyotr Ilyich Tchaikovsky said of his poignant Symphony No. 6, Pathétique, “I love it as I have never loved any of my musical children.” It was his last completed work; he led the premiere less than two weeks before his death"
Karaoke Hosted By DJ Matty,Not specified,Not specified,Not specified,Not specified,Dorchester Brewing Company,1250 Massachusetts Ave,FREE,"Drinks, Good for Groups, Music, Nightlife",https://www.dorchesterbrewing.com/events/event/karaoke-hosted-by-dj-matty/,"DJ Matty is bringing the art of KARAOKE to Dorchester Brewing Co. on Saturday (11/16) from 8-11pm. No cover, no cost, just bring your friends and ready those vocals!This event is 21+ DJ Matty is bringing the art of KARAOKE to Dorchester Brewing Co. on Saturday (11/16) from 8-11pm. No cover, no cost, just bring your friends and ready those vocals! This event is 21+"
$10 Commuter Rail Weekends,"Saturday, Nov 16, 2024",5:00a,"Sunday, Nov 17, 2024",11:59p,Boston,Surrounding areas,$10,Not specified,https://www.mbta.com/fares/commuter-rail-weekends,"Enjoy unlimited travel on the Commuter Rail for just $10 every weekend. Passes are valid on all lines and zones, Saturdays and Sundays.To get your weekend pass:Buy on the mTicket app, available from iTunes and Google PlayStop by the ticket windows at North, South, and Back Bay stationsBuy on board with cash or creditWeekend passes are not available at fare vending machines or retail sales locations.Download mTicket Enjoy unlimited travel on the Commuter Rail for just $10 every weekend. Passes are valid on all lines and zones, Saturdays and Sundays. To get your weekend pass: Weekend passes are not available at fare vending machines or retail sales locations. Download mTicket"
Free Hard Cider Tasting at Cider Hill Farm,Not specified,Not specified,Not specified,Not specified,Cider Hill Farm,45 Fern Avenue,FREE,"Drinks, Farms, Seasonal, Shopping",https://www.ciderhill.com/farm-events,"Enjoy free samples of award-winning hard cider and non-alcoholic sparkling cider produced and bottled on Cider Hill Farm's 145 acre property. This month, the farm is featuring their Bourbon Barrel Aged Winter frost cider that has been aged in Kentucky bourbon barrels for 2 years. While you're visiting, the Farm Store is full of holiday goods, produce, farmhouse treats and grocery items. Enjoy free samples of award-winning hard cider and non-alcoholic sparkling cider produced and bottled on Cider Hill Farm's 145 acre property. This month, the farm is featuring their Bourbon Barrel Aged Winter frost cider that has been aged in Kentucky bourbon barrels for 2 years. While you're visiting, the Farm Store is full of holiday goods, produce, farmhouse treats and grocery items."
"$15 Early Bird Ticket Special Ends ToNightFun Dodgeball, All Levels are Welcome!(Multi-Group Event)",Not specified,Not specified,Not specified,Not specified,Andrew Peabody School,70 Rindge Avenue,$15.00,"Drinks, Food, Meetup, Sports & Active Life",https://fun-dodgeball-Nov-16-2024.eventbrite.com,"The Fun Dodgeballs have went so well and we have had so much interest that it is now a 3rd Saturday Event(This will be our 66th now) (Next Upcoming 11/16)Come join in on the fun, no experience necessary, bring Family, Friends, Co-Workers!Early Bird Ticket Special, Go to Link to Purchase: https://fun-dodgeball-Nov-16-2024.eventbrite.com(You may Venmo DavidM0625(Can do Cash App too) & Save on Eventbrite Fees or If paying $20 cash Onsite, please have exact change, but no $1's!)If at all possible and you are definitely coming please message us NLT 10/14 to let us know. It will help us out a lot.Check-In at 7:00pm outside gymnasium and we generally get started at 7:30pm and finish around 9:30pm.(We play for approximately 90 Minutes to 2 Hours)Again, All Levels are Welcome this is a fun Dodgeball social atmosphere not the same as the dodgeball you may have played growing up or the movie.We will be playing against each other and having a fun time.How to find us:Fun Dodgeball will be in the Andrew Peabody School Gymnasium and it is located on the Cambridge/Somerville Line and near the Red Line in between Davis Square and Porter Square Stops.(Parking on Haskell Street 25 spots on left side by school and behind entrance to gym there as well)Please look for David at the entrance to the gym or inside the gym, if you need help finding us, please call 617 548 6208.This will be a joint event with several meet up groups.After Fun Dodgeball we head to:Joe Sent Me2388 Massachusetts AveCambridge, MA** Sorry No Refunds **Here are some of the basic rules to know in advance to coming to Fun Dodgeball:#1 Have Fun#2 Head Shots(From the neck up you are not out)#3 Only the person the ball that is throwing it, can catch it for another person to be out(it is live to catch until it hits the ground or another person)#4 If you use a ball to block a ball you are out if you drop the ball already in your hands or if it hits your hands/finger tips while blocking, ball is dead after that#5 You must stay within the boundaries setup to catch a ball or throw it#6 You may only go over the center black line if you throw the ball before go over or if your throw it before your feet touch the ground or you are out!!#7 When starting the game you are only going for the balls on the right and balls must clear the prescribed cone before they can be thrown#8 We may enforce a 10-15 Second holding time before you must throw the ball#9 All rules are subject to amendments or more rules to be added.Liability Release - AS A CONDITION OF ATTENDING THIS MEETUP, YOU AGREE TO hold harmless, and indemnify the organizer and her heirs, and all members and participants of this Meetup group from any and all claims for injury, illness, death, and/or property damage including those caused by negligence, ignorance, inexperience and other reasons. You also agree to assume all mental, physical, financial, and/or other risk associated with this meetup. All meetup activities pose inherent risks and dangers. Participation in these activities is voluntary and dependent upon your own personal judgment. The Fun Dodgeballs have went so well and we have had so much interest that it is now a 3rd Saturday Event(This will be our 66th now) (Next Upcoming 11/16) Come join in on the fun, no experience necessary, bring Family, Friends, Co-Workers! Early Bird Ticket Special, Go to Link to Purchase: https://fun-dodgeball-Nov-16-2024.eventbrite.com(You may Venmo DavidM0625(Can do Cash App too) & Save on Eventbrite Fees or If paying $20 cash Onsite, please have exact change, but no $1's!) If at all possible and you are definitely coming please message us NLT 10/14 to let us know. It will help us out a lot. Check-In at 7:00pm outside gymnasium and we generally get started at 7:30pm and finish around 9:30pm.(We play for approximately 90 Minutes to 2 Hours) Again, All Levels are Welcome this is a fun Dodgeball social atmosphere not the same as the dodgeball you may have played growing up or the movie. We will be playing against each other and having a fun time. How to find us: Fun Dodgeball will be in the Andrew Peabody School Gymnasium and it is located on the Cambridge/Somerville Line and near the Red Line in between Davis Square and Porter Square Stops. (Parking on Haskell Street 25 spots on left side by school and behind entrance to gym there as well) Please look for David at the entrance to the gym or inside the gym, if you need help finding us, please call 617 548 6208. This will be a joint event with several meet up groups. After Fun Dodgeball we head to: Joe Sent Me 2388 Massachusetts Ave Cambridge, MA ** Sorry No Refunds ** Here are some of the basic rules to know in advance to coming to Fun Dodgeball: #1 Have Fun #2 Head Shots(From the neck up you are not out) #3 Only the person the ball that is throwing it, can catch it for another person to be out(it is live to catch until it hits the ground or another person) #4 If you use a ball to block a ball you are out if you drop the ball already in your hands or if it hits your hands/finger tips while blocking, ball is dead after that #5 You must stay within the boundaries setup to catch a ball or throw it #6 You may only go over the center black line if you throw the ball before go over or if your throw it before your feet touch the ground or you are out!! #7 When starting the game you are only going for the balls on the right and balls must clear the prescribed cone before they can be thrown #8 We may enforce a 10-15 Second holding time before you must throw the ball #9 All rules are subject to amendments or more rules to be added. Liability Release - AS A CONDITION OF ATTENDING THIS MEETUP, YOU AGREE TO hold harmless, and indemnify the organizer and her heirs, and all members and participants of this Meetup group from any and all claims for injury, illness, death, and/or property damage including those caused by negligence, ignorance, inexperience and other reasons. You also agree to assume all mental, physical, financial, and/or other risk associated with this meetup. All meetup activities pose inherent risks and dangers. Participation in these activities is voluntary and dependent upon your own personal judgment."
Union Improv Festival,"Thursday, Nov 14, 2024",7:00p,"Saturday, Nov 16, 2024",11:59p,The Rockwell,255 elm st,Unknown,"Festivals & Fairs, Good for Groups, Nightlife, Shows",https://www.unioncomedy.com/festival,"Hosted by Union Comedy, this 3-day festival showcases improv comedy from teams from Boston, NYC, Florida & more! All tickets are on sale now, and there are FestPass options as well. Check it out on our website!"
Social at Bar Moxy then GO PARTY at BSMNT! FREE!,"Saturday, Nov 16, 2024",8:00p,"Sunday, Nov 17, 2024",2:00a,Bar Moxy,240 Tremont St,FREE,"Meetup, Music, Nightlife, Party",https://www.meetup.com/fuckitimsocial/events/304490612/,"https://www.meetup.com/fuckitimsocial/events/304490612/These events are designed so people that actually want to come out, drink, party, and make new friends in Boston can, while mitigating some cost along the way. The goal is to bring together a welcoming social group of young professionals 21-35 to go out with on the weekend.Schedule:- Starting at 8p we'll meet up for a social at Bar Moxy (2nd floor of the Moxy Hotel) and grab some drinks.- Around 10p we'll leave the bar and head over to BSMNT!BSMNT is a club and may enforce their dress code that is dressy casual, general rule of thumb is:Gents: Shirt Up, Jeans/Pants, Dress Shoes(no work boots, shorts, hat, ripped clothing or athletic gear or tees/sandals)Ladies: Dress for a night club - they are generally less stringent for you compared to the guysTo get into the club with us you will need a WRISTBAND from me, cost for this night will be:FREE!This covers your wristband, the social at the bar, and entry into the club!This saves you $20-25 compared to the normal cover, but you must get a wristband and enter with me. Please note that once we're in it is hard if not impossible for me to get people that are late in the door. Make sure to get to the bar before BSMNT to ensure you get a wristband.Let's have a crazy and epic night! https://www.meetup.com/fuckitimsocial/events/304490612/ These events are designed so people that actually want to come out, drink, party, and make new friends in Boston can, while mitigating some cost along the way. The goal is to bring together a welcoming social group of young professionals 21-35 to go out with on the weekend. Schedule: - Starting at 8p we'll meet up for a social at Bar Moxy (2nd floor of the Moxy Hotel) and grab some drinks. - Around 10p we'll leave the bar and head over to BSMNT! BSMNT is a club and may enforce their dress code that is dressy casual, general rule of thumb is: Gents: Shirt Up, Jeans/Pants, Dress Shoes (no work boots, shorts, hat, ripped clothing or athletic gear or tees/sandals) Ladies: Dress for a night club - they are generally less stringent for you compared to the guys To get into the club with us you will need a WRISTBAND from me, cost for this night will be: FREE! This covers your wristband, the social at the bar, and entry into the club! This saves you $20-25 compared to the normal cover, but you must get a wristband and enter with me. Please note that once we're in it is hard if not impossible for me to get people that are late in the door. Make sure to get to the bar before BSMNT to ensure you get a wristband. Let's have a crazy and epic night!"
